{
  "entity_type": "founder_decision",
  "schema_version": "1.0.0",
  "decision_id": "DEC-E2E-APP-001",
  "decision_version": "1.0.0",
  "opportunity_id": "OPP-E2E-001",
  "priority_assessment_id": "PRIO-E2E-001",
  "recommendation": "P1",
  "decision": "APPROVE",
  "decision_reason": "Approved by Founder: fundamental entity discoverability required.",
  "decision_notes": "",
  "evidence_refs": [],
  "created_at": "2026-10-03T10:08:14.946Z",
  "decided_at": "2026-10-03T10:08:14.946Z",
  "decided_by": "FOUNDER",
  "status": "DECIDED",
  "is_immutable": true,
  "metadata": {}
}