{
  "entity_type": "founder_decision",
  "schema_version": "1.0.0",
  "decision_id": "DEC-B05-APP-001",
  "decision_version": "1.0.0",
  "opportunity_id": "OPP-B05-QUAL-001",
  "priority_assessment_id": "PRIO-B05-001",
  "recommendation": "P0",
  "decision": "APPROVE",
  "decision_reason": "Approved for controlled implementation.",
  "decision_notes": "",
  "evidence_refs": [
    "EVD-VIS-T1-CHATGPT-P01"
  ],
  "created_at": "2026-10-03T10:04:37.383Z",
  "decided_at": "2026-10-03T10:04:37.383Z",
  "decided_by": "FOUNDER",
  "status": "DECIDED",
  "is_immutable": true,
  "metadata": {}
}