{
  "entity_type": "founder_decision",
  "schema_version": "1.0.0",
  "decision_id": "DEC-B05-REJ-003",
  "decision_version": "1.0.0",
  "opportunity_id": "OPP-B05-QUAL-001",
  "priority_assessment_id": "PRIO-B05-001",
  "recommendation": "P3",
  "decision": "REJECT",
  "decision_reason": "Not aligned with current focus.",
  "decision_notes": "",
  "evidence_refs": [],
  "created_at": "2026-10-03T10:04:37.608Z",
  "decided_at": "2026-10-03T10:04:37.608Z",
  "decided_by": "FOUNDER",
  "status": "DECIDED",
  "is_immutable": true,
  "metadata": {}
}