{
  "entity_type": "founder_decision",
  "schema_version": "1.0.0",
  "decision_id": "DEC-TEST-006",
  "decision_version": "1.0.0",
  "opportunity_id": "OPP-B04-QUAL-001",
  "priority_assessment_id": "PRIO-TEST-005-A",
  "recommendation": "P1",
  "decision": "DEFER",
  "decision_reason": "Deferred by Founder pending Q4 technical resource reallocation.",
  "decision_notes": "",
  "evidence_refs": [],
  "created_at": "2026-10-03T10:04:33.007Z",
  "decided_at": "2026-10-03T10:04:33.007Z",
  "decided_by": "FOUNDER",
  "status": "DECIDED",
  "is_immutable": true,
  "metadata": {}
}