{
  "entity_type": "founder_decision",
  "schema_version": "1.0",
  "decision_id": "DEC-LOG-TEST-001",
  "decision_version": "1.0",
  "opportunity_id": "OPP-B06-001",
  "priority_assessment_id": "PRIO-B06-001",
  "recommendation": "P0",
  "decision": "APPROVE",
  "decision_reason": "Approved for production pilot by Founder.",
  "decision_notes": "",
  "evidence_refs": [
    "EVD-VIS-T1-CHATGPT-P01"
  ],
  "created_at": "2026-10-03T10:04:54.293Z",
  "decided_at": "2026-10-03T10:04:54.293Z",
  "decided_by": "FOUNDER",
  "status": "DECIDED",
  "is_immutable": false
}