{
  "entity_type": "founder_decision",
  "schema_version": "1.0.0",
  "decision_id": "DEC-TEST-008",
  "decision_version": "1.0.0",
  "opportunity_id": "OPP-B04-QUAL-001",
  "priority_assessment_id": "PRIO-TEST-001",
  "recommendation": "P0",
  "decision": "DEFER",
  "decision_reason": "Founder override: Prioritizing foundation stability before dependency execution.",
  "decision_notes": "",
  "evidence_refs": [],
  "created_at": "2026-10-03T10:04:33.583Z",
  "decided_at": "2026-10-03T10:04:33.583Z",
  "decided_by": "FOUNDER",
  "status": "DECIDED",
  "is_immutable": true,
  "metadata": {}
}